{
  "$schema": "https://json-schema.org/draft/2020-12/schema",
  "$id": "https://raw.githubusercontent.com/cantasci/deliver-floor/main/kit/skills/deliver/deliver.schema.json",
  "title": ".deliver.json — how /deliver runs in this repository",
  "description": "Per-repo settings for the deliver plugin. Deep-merged over the kit defaults (kit/skills/deliver/config.json). `dl config` shows what applies; a running job keeps the snapshot it took at `dl new`. Reference: docs/03-settings.md.",
  "type": "object",
  "properties": {
    "$schema": { "type": "string" },
    "dispatch": {
      "enum": ["munder", "subagent"],
      "default": "munder",
      "description": "munder (default): every role is a person at a seat on the Munder Difflin floor; /deliver in a terminal opens the app and hands the job to Michael there. subagent: roles run as Claude Code subagents in one claude session (no app; required for unattended runs). Chosen by the human; Michael never switches it."
    },
    "base_branch": { "type": "string", "default": "auto", "description": "Branch the job starts from and the PR targets (auto = the main checkout's current branch)." },
    "record_job": { "type": "boolean", "default": true, "description": "dl ship commits the job's record to .deliver/jobs/<job>/ with its code: the request, the readiness decisions and their sources, the plan, the specs, the board (every gate, QA and review verdict), the report and the event log — the audit trail in git. false keeps it in .work/ only." },
    "qa_verify_full": { "type": "boolean", "default": true, "description": "A QA pass also runs verify_full on the card's commit, with the dev's and QA's tests together, before review — catches tests that pass alone but break the suite together (e.g. two helpers with the same module name). false only for a suite too slow to run per card; verify_full still runs on the job branch at the end." },
    "verify_full": { "type": "string", "default": "", "description": "The full test suite, run on the job branch after every card merged (what your CI runs). Detected from the repo when /deliver writes this file; in a repo without code it is set once the stack is decided." },
    "worktree_setup": { "type": "string", "default": "", "description": "Runs in every new card worktree (install deps, copy .env, …)." },
    "worktree_exclude": { "type": "array", "items": { "type": "string" }, "description": "Paths worktree_setup creates that never count as changes." },
    "merge_mode": {
      "enum": ["human", "semi", "auto", "local"],
      "default": "human",
      "description": "human: a PR you merge · semi: auto-merge armed, you approve · auto: merged on green CI · local: merged into the base branch locally, no remote."
    },
    "max_parallel": { "type": "integer", "minimum": 1, "default": 3, "description": "Cards running at once (all roles together)." },
    "qa_early": { "type": "boolean", "default": true, "description": "QA writes each card's tests from its spec while the developer builds it (own worktree; joined after the gate with dl qa-join), instead of after the gate." },
    "max_attempts": { "type": "integer", "minimum": 1, "default": 2, "description": "Tries per card before it is blocked and Michael decides (split, replace or drop — listed in the PR)." },
    "gates": {
      "type": "object",
      "properties": { "plan": { "type": "boolean", "default": false, "description": "true: you approve the plan and board before any code." } }
    },
    "gate_timeout": { "type": "integer", "default": 1800, "description": "Seconds a card's verify / qa_verify may run." },
    "stop_guard_max": { "type": "integer", "default": 5 },
    "push_branches": { "enum": ["auto", true, false], "default": "auto" },
    "roles": {
      "type": "object",
      "description": "Project defaults per role, applied when Michael picks the roles. A role entry that names its own value (from the request's Staffing, or what you tell Michael at the start) keeps it. Role names: ba, backend, frontend, mobile, database, qa, backend-lead, frontend-lead, reviewer-<stack>, security, accessibility, performance, …",
      "additionalProperties": {
        "type": "object",
        "properties": {
          "model": { "type": "string", "description": "e.g. opus, sonnet, haiku, or another CLI's model (gpt-5-codex)." },
          "provider": { "type": "string", "enum": ["claude", "codex", "gemini", "grok", "kimi", "qwen", "opencode", "crush", "pi", "copilot", "cursor", "antigravity"], "description": "Which CLI runs the role (non-Claude needs dispatch munder)." },
          "count": { "type": "integer", "minimum": 1, "description": "Seats of this role working in parallel (backend#1, backend#2 …)." }
        },
        "additionalProperties": false
      }
    },
    "munder": {
      "type": "object",
      "properties": {
        "hive_root": { "type": "string", "description": "The Munder Difflin hive folder for this repo (the app's harnessHome). /deliver opens the app on it." },
        "app_command": { "type": "string", "description": "How to start Munder Difflin when it is not running (default: the installed app, or `npm run preview` in the source checkout scripts/init.sh made)." },
        "model": { "type": "string", "default": "sonnet", "description": "Model of every Claude seat whose role names none. Seats never start on the app's default model." },
        "seat_timeout_minutes": { "type": "integer", "minimum": 0, "default": 5, "description": "A seat with no 'seated' message this long after hiring is failed (dl md-seats says why; Michael re-seats it)." },
        "claude_command": { "type": "string", "default": "claude", "description": "Command the Claude seats run (a wrapper or pinned path)." },
        "token_cap": { "type": "integer", "minimum": 0, "default": 0 }
      }
    },
    "tracker": {
      "type": "object",
      "properties": {
        "kind": { "type": "string", "default": "local", "description": "local (kanban + kanban.html), jira, asana, linear, github (GitHub Projects), or a registered tracker plugin." },
        "columns": { "type": "object", "description": "Your board's own names for the stages: todo, in_progress, qa, review, done, blocked, wontdo (default To Do, In Progress, QA, Code Review, Done, Blocked, Won't Do)." },
        "jira": { "type": "object", "description": "project (key), issue_type, epic_type, labels, api_version. Credentials: JIRA_BASE_URL + JIRA_EMAIL + JIRA_API_TOKEN, or JIRA_PAT." },
        "asana": { "type": "object", "properties": { "project": { "type": "string", "description": "The project's gid (from its URL); its sections are the columns." } }, "description": "Credentials: ASANA_TOKEN (a personal access token)." },
        "linear": { "type": "object", "properties": { "team": { "type": "string", "description": "The team's key (e.g. ENG); its workflow states are the columns." } }, "description": "Credentials: LINEAR_API_KEY." },
        "github": { "type": "object", "properties": {
          "repo": { "type": "string", "description": "owner/name — where the issues are opened." },
          "project": { "type": "integer", "description": "The project (v2) number, from its URL." },
          "project_owner": { "type": "string", "description": "The organization or user that owns the project (default: the repo's owner)." },
          "status_field": { "type": "string", "default": "Status", "description": "The project's single-select field whose options are the columns." },
          "labels": { "type": "array", "items": { "type": "string" }, "description": "Labels put on every issue (they must exist in the repo)." } },
          "description": "Credentials: GITHUB_TOKEN (or GH_TOKEN) with access to the repo's issues and the project." }
      }
    },
    "knowledge": {
      "type": "object",
      "description": "The shared knowledge repo — standards and lessons several projects share. dl new clones it (into ~/.deliver/shared/) and updates it at every job's start; shared lessons are proposed to it as a PR. Without it, each project keeps its own in .deliver/knowledge/.",
      "properties": {
        "repo": { "type": "string", "description": "git URL or path of the shared knowledge repo (standards/*.md, lessons.md)." },
        "branch": { "type": "string", "description": "Its branch (default: the clone's default branch)." }
      }
    },
    "commit": {
      "type": "object",
      "properties": {
        "convention": { "enum": ["auto", "conventional", "plain"], "default": "auto", "description": "The repo's commit message convention — every commit of a job follows it (the devs', QA's and dl's own merges; the gate checks the card's commits, with the repo's own commitlint when installed). Detected when this file is written: commitlint / commitizen / a commit-msg hook, else the history." },
        "merge_message": { "type": "string", "default": "", "description": "The message of dl's merge commits, when the convention's default forms are refused by the repo's hooks: {card}, {title} and {key} (the tracker key) are filled in. Empty: dl picks a form that fits the convention." },
        "ai_attribution": { "type": "boolean", "default": false, "description": "false: commits must not carry AI attribution (the gate checks)." },
        "role_in_message": { "type": "boolean", "default": false, "description": "true: every card commit carries a 'Role: <seat>' trailer." }
      }
    }
  }
}
