{
  "$schema": "https://raw.githubusercontent.com/cantasci/deliver-floor/main/kit/skills/deliver/deliver.schema.json",
  "dispatch": "subagent",
  "verify_full": "npm test",
  "worktree_setup": "",
  "worktree_exclude": [
    ".claude/settings.local.json",
    ".env",
    ".venv",
    "node_modules"
  ],
  "merge_mode": "local",
  "max_parallel": 3,
  "max_attempts": 2,
  "roles": {},
  "munder": {
    "hive_root": "",
    "model": "sonnet",
    "seat_timeout_minutes": 5,
    "app_command": ""
  },
  "tracker": {
    "kind": "local"
  },
  "commit": {
    "ai_attribution": false,
    "role_in_message": false
  }
}
